<?xml version="1.0" encoding="UTF-8"?>
<!ELEMENT supply_stream (order*)>
<!ELEMENT order (order_id, date, supplier_name, order_price, products)>
<!ELEMENT order_id (#PCDATA)>
<!ELEMENT date (day, month, year)>
<!ELEMENT day (#PCDATA)>
<!ELEMENT month (#PCDATA)>
<!ELEMENT year (#PCDATA)>
<!ELEMENT supplier_name (#PCDATA)>
<!ELEMENT order_price (#PCDATA)>
<!ELEMENT products (product+)>
<!ELEMENT product (product_id, category, product_name, manufacturer_name, quantity, unit_price, additional_details)>
<!ELEMENT product_id (#PCDATA)>
<!ELEMENT category (#PCDATA)>
<!ELEMENT product_name (#PCDATA)>
<!ELEMENT manufacturer_name (#PCDATA)>
<!ELEMENT quantity (#PCDATA)>
<!ELEMENT unit_price (#PCDATA)>
<!ELEMENT additional_details (lot_number, expiry_date, is_fragile, requires_refrigeration)>
<!ELEMENT lot_number (#PCDATA)>
<!ELEMENT expiry_date (day, month, year)>
<!ELEMENT is_fragile (#PCDATA)>
<!ELEMENT requires_refrigeration (#PCDATA)>

